{
  "project_id": "opp-8",
  "stage": "validation",
  "status": "success",
  "generated_at": "2026-10-10T03:01:22.367132+00:00",
  "summary": "[MOCK] Simulated validation for 'opp-8'. Hypothesis validation used synthetic data only. No real user interviews or surveys were conducted.",
  "mode": "mock",
  "is_real_data": false,
  "evidence": [
    {
      "source_type": "simulated",
      "claim": "70% of surveyed users expressed interest in the proposed solution",
      "evidence_type": "assumption",
      "confidence": "unavailable",
      "notes": "Simulated survey – no real users surveyed"
    }
  ],
  "assumptions": [
    {
      "statement": "Users will pay $9/month for this product",
      "risk_if_wrong": "Revenue projections would need significant revision",
      "how_to_verify": "Run a landing-page test with pricing tiers"
    }
  ],
  "risks": [
    {
      "description": "Simulated validation may overestimate real demand",
      "severity": "medium",
      "mitigation": "Follow up with real user interviews before building"
    }
  ],
  "artifacts": [
    {
      "name": "validation-report",
      "path": "research/mock-validation-report.json",
      "type": "json"
    }
  ],
  "next_actions": [
    {
      "action": "Design and run a real landing-page smoke test",
      "priority": "high"
    },
    {
      "action": "Validate willingness-to-pay with 5 target users",
      "priority": "high"
    }
  ]
}
