{
  "project_id": "new",
  "stage": "discovery",
  "status": "success",
  "generated_at": "2026-10-10T02:17:48.834952+00:00",
  "summary": "[MOCK] Simulated discovery for 'new'. Identified 3 potential problem areas and 2 target customer segments. No real market research was performed.",
  "mode": "mock",
  "is_real_data": false,
  "evidence": [
    {
      "source_type": "simulated",
      "claim": "Small-business owners spend 6+ hours/week on manual scheduling",
      "evidence_type": "assumption",
      "confidence": "unavailable",
      "notes": "Simulated – no real survey conducted"
    },
    {
      "source_type": "simulated",
      "claim": "Existing tools charge $20-50/month for basic features",
      "evidence_type": "assumption",
      "confidence": "unavailable",
      "notes": "Simulated – no real pricing research performed"
    }
  ],
  "assumptions": [
    {
      "statement": "Target users have basic technical literacy",
      "risk_if_wrong": "Product may need more onboarding support",
      "how_to_verify": "Conduct 10 user interviews with target segment"
    }
  ],
  "risks": [
    {
      "description": "Market may be saturated with established players",
      "severity": "high",
      "mitigation": "Differentiate on simplicity and price"
    }
  ],
  "artifacts": [
    {
      "name": "discovery-summary",
      "path": "research/mock-discovery-result.json",
      "type": "json"
    }
  ],
  "next_actions": [
    {
      "action": "Conduct competitor analysis on top 5 alternatives",
      "priority": "high"
    },
    {
      "action": "Define target customer persona",
      "priority": "high"
    },
    {
      "action": "Draft problem-solution fit hypothesis",
      "priority": "medium"
    }
  ]
}
